{
  "metadata": {
    "name": "Modern Collaborative Finance",
    "version": "1.0.0",
    "author": "Unknown",
    "created_at": ""
  },
  "design_direction": {
    "style": "Modern SaaS Minimalism",
    "target_audience": "Financial teams and collaborative workspaces",
    "summary": "A modern collaborative dashboard system optimized for readability, scalability, and enterprise usability."
  },
  "colors": {
    "primary": "#3B82F6",
    "secondary": "#64748B",
    "background": "#0F172A",
    "text": "#F8FAFC"
  },
  "typography": {
    "primary_font": "Inter",
    "heading_scale": [
      "48px",
      "36px",
      "28px",
      "22px"
    ],
    "body_size": "16px"
  },
  "spacing": {
    "spacing_scale": [
      "4px",
      "8px",
      "12px",
      "16px",
      "24px",
      "32px"
    ]
  },
  "layout": {
    "grid_system": "12-column responsive grid",
    "breakpoints": [
      "640px",
      "768px",
      "1024px",
      "1280px"
    ]
  },
  "components": {
    "buttons": {
      "style": "rounded minimal buttons"
    },
    "cards": {
      "style": "soft shadow cards"
    }
  },
  "accessibility": {
    "wcag_target": "WCAG AA",
    "contrast_strategy": "High contrast text/background pairings"
  }
}